post_id,post_title,post_author,post_content,post_category,default_category,post_tags,post_type,post_status,is_featured,claimed,package_id,alive_days,expire_date,post_date,post_address,post_city,post_region,post_country,post_zip,post_latitude,post_longitude,post_neighbourhood,neighbourhood_latitude,neighbourhood_longitude,geodir_timing,geodir_contact,geodir_email,geodir_website,geodir_twitter,geodir_facebook,geodir_video,geodir_special_offers,linked_cpt_ID,geodir_backendextrainfo,geodir_ethicalcriteria,geodir_get_directions,geodir_twitterusername,geodir_Instagram,geodir_Calltoaction,gd_is_franchise,gd_franchise_lock,franchise,IMAGE,IMAGE,IMAGE,IMAGE,IMAGE,IMAGE,IMAGE,IMAGE,IMAGE,IMAGE,IMAGE,IMAGE,IMAGE,IMAGE,IMAGE,IMAGE,IMAGE,IMAGE,IMAGE,IMAGE,IMAGE,IMAGE,IMAGE,IMAGE,IMAGE,IMAGE,IMAGE,IMAGE,IMAGE,IMAGE,IMAGE,IMAGE,IMAGE,IMAGE,IMAGE,IMAGE,IMAGE,IMAGE,IMAGE,IMAGE,IMAGE,IMAGE
2151,Fadi’s Gourmet Poutine [BLUESFEST VENDOR],5,"VEGAN OPTIONS
French Fries $5.50
Falafel Sandwich $9.75
Potatoes $7.50

*Gravy is not vegetarian and Garlic Sauce is not vegan*",Food Trucks,Food Trucks,"Bluesfest,Falafel,Fries,Shawarma,Vegan",gd_place,private,,,1,0,Never,2016-07-09 14:38,Bluesfest & Landsdowne,Ottawa,Ontario,Canada,,45.399158,-75.681092,,,,Open during BLUESFEST,6132202025,,,,https://www.facebook.com/Fadis-Fabulous-Foods-1568335753422932/,,,,,Vegetarian,Get Directions,,,,1,"claimed,gd_placecategory,geodir_email,geodir_facebook,geodir_contact,geodir_timing,geodir_twitter,geodir_website,geodir_backendextrainfo,geodir_ethicalcriteria",0,,,,,,,,,,,,,,,,,,,,,,,,,,,,,,,,,,,,,,,,,,
2153,The Grilled Cheeserie [BLUESFEST VENDOR],5,"VEGETARIAN OPTIONS
The Classic Grilled Cheese – served with Fries + Pickle $10.00
Balsamic Bruschetta Grilled Cheese -served with Fries + Pickle $13.00

NO VEGAN OPTIONS",Food Trucks,Food Trucks,"Bluesfest,Grilled Cheese",gd_place,private,,,1,0,Never,2016-07-09 14:56,Bluesfest & Landsdowne,Ottawa,Ontario,Canada,,45.39925262,-75.6811109,,,,Open during BLUESFEST,6132766583,,http://www.thegrilledcheeserie.com,,https://www.facebook.com/thegrilledcheeserie/,,,,,Vegetarian,Get Directions,,,,0,,0,,,,,,,,,,,,,,,,,,,,,,,,,,,,,,,,,,,,,,,,,,
2155,Green Papaya [BLUESFEST VENDOR],5,"VEGAN OPTIONS
<span data-sheets-value=""{&quot;1&quot;:2,&quot;2&quot;:&quot;Vegetable Spring rolls (2) $5.00&quot;}"" data-sheets-userformat=""{&quot;2&quot;:513,&quot;3&quot;:{&quot;1&quot;:0},&quot;12&quot;:0}"">Vegetable Spring rolls (2) $5.00
Green Curry with rice (tofu option) $13.00</span>",Food Trucks,Food Trucks,"Best Asian Restaurants with Vegan and Vegetarian Options in Ottawa,Cuisine,Curry,Papaya,Restaurant,thai",gd_place,private,,,1,0,Never,2016-07-09 15:00,Bluesfest & Landsdowne,Ottawa,Ontario,Canada,,45.399055,-75.681091,,,,Open during BLUESFEST,,,http://www.greenpapaya.ca,https://twitter.com/GreenPapayaRest,,,,,,"Vegan,Vegetarian",Get Directions,,,,0,,1101,,,,,,,,,,,,,,,,,,,,,,,,,,,,,,,,,,,,,,,,,,
2157,Poutine Machine [BLUESFEST VENDOR],5,"VEGETARIAN OPTIONS
Fried jalapeno Wontons $12.00

NO VEGAN OPTIONS",Food Trucks,Food Trucks,"Bluesfest,Poutine,Wontons",gd_place,private,,,1,0,Never,2016-07-09 15:23,1 Vimy Pl,Ottawa,Ontario,Canada,,45.41519716,-75.71925233,,,,Open during Bluesfest hours,,,,,,,,,,Vegetarian,Get Directions,,,,0,,0,,,,,,,,,,,,,,,,,,,,,,,,,,,,,,,,,,,,,,,,,,
2159,Iceco [BLUESFEST VENDOR],5,"We've been serving cool treats and making ice in Ottawa since 1970. Thank you for your patronage!

All options are vegetarian but not vegan.",Food Trucks,Food Trucks,"Bluesfest,Ice Cream",gd_place,private,,1,1,0,Never,2016-09-15 9:19,Bluesfest @ Landsdowne,Ottawa,Ontario,Canada,,45.39927233,-75.68157437,,,,,6132498724,frankjj2015@gmail.com,http://iceco.ca/,,https://www.facebook.com/icecoottawa/,,,,,Vegetarian,Get Directions,,,,0,,0,,,,,,,,,,,,,,,,,,,,,,,,,,,,,,,,,,,,,,,,,,
2173,Nacho Cartel,5,"We believe in challenging the status quo. We believe creativity and perseverance are key factors in achieving your dreams; hopefully our example will help others pursue their dreams!  

We strive to provide Ottawa , Canada with unique and palatable gourmet nachos, tacos and milkshakes. Each ingredient and dish in our modest menu has been meticulously tested and prepared.

Great cauliflower taco vegan option (ask for no mayo)!

All our items with the exception of the utila shrimp taco are absolutely gluten-free. Our chips and tortillas are made from 100% corn tortillas. 

For more information please visit www.nachocartel.com",Food Trucks,Food Trucks,"Best Mexican Restaurants with Vegan and Vegetarian Options in Ottawa,Best Vegan and Vegetarian Restaurants for Grab-and-Go Lunches in Ottawa,Food Stand,Food Truck,foodtruck,Nacho Cartel,Restaurant",gd_place,publish,,,1,0,Never,2017-07-22 10:47,200 Wilbrod St,Ottawa,ON,Canada,,45.42574,-75.68428,sandy-hill,45.42574,-75.68428,,6138648975,eat@nachocartel.com,http://www.nachocartel.com,https://twitter.com/Nachocartel,https://www.facebook.com/nachocartel/,,,,Co-founded by Aida C. Alvarenga,"Vegan,Vegetarian,Woman-owned",Get Directions,,,,0,,0,https://ethicaltree.com/wp-content/uploads/2017/07/2173_cartel.jpg,https://ethicaltree.com/wp-content/uploads/2017/07/11037213_401383730068141_2766635226534525501_o.jpg,,,,,,,,,,,,,,,,,,,,,,,,,,,,,,,,,,,,,,,,
2175,SemSem,5,"Moroccan restaurant with food made from scratch. Almost entirely vegetarian menu with a few vegan options too.

Premium café (9AM - Close)
Brunch (9:00am to 3:00pm)
Freshly Baked goods
Distinct taste
Vibrant mood
Dine In/take out",Restaurants,Restaurants,"Best Sit-Down Restaurants in Ottawa,Coffee Shop,Restaurant,SemSem",gd_place,publish,,,1,0,Never,2017-07-22 11:12,2430 Bank St,Ottawa,Ontario,Canada,,45.3534818,-75.6487693,Ottawa South,45.3807492,-75.6703238,,6137335736,info@semsem.ca,http://semsem.ca,,https://www.facebook.com/semsemcanada/,,,,,"Vegan,Vegetarian",Get Directions,,,,0,,0,https://ethicaltree.com/wp-content/uploads/2017/07/2175_semsempic.jpg,https://ethicaltree.com/wp-content/uploads/2017/07/13872994_1201208359930452_1109497838538113104_n.png,,,,,,,,,,,,,,,,,,,,,,,,,,,,,,,,,,,,,,,,
2177,SQUISH,5,"WELCOME TO SQUISH. In case you hadn’t noticed, we really LOVE gummies - and we don’t just sell regular gummies. We sell gummies and candies crafted from only the highest quality ingredients possible. Made in the ancestral homeland of the gummy bear, deep in the magical woods of southern Bavaria, we have seen what imagination and good taste can produce and it is out of this world delicious. Our flavour categories will help guide you through our selection of over 100 types of gummies.

Inside the Rideau Centre. Many vegan options. All candies labelled vegan or vegetarian.

BIENVENUE CHEZ SQUISH. Au cas où vous ne l’auriez pas remarqué, nous ADORONS les bonbons gélifiés. Et les oursons de gélatine Squish ne sont pas des bonbons ordinaires. Fabriqués sur les terres ancestrales des oursons de gélatine, dans les profondeurs des forêts enchantées du sud de la Bavière, nos bonbons gélifiés et autres friandises sont faits uniquement d’ingrédients de la meilleure qualité qui soit. Explorez notre gamme de plus de 100 saveurs, regroupées en amusantes catégories, et découvrez ce que l’imagination et le bon goût peuvent produire dans le plaisir!",Local Stores,Local Stores,"candy,SQUISH,Vegan",gd_place,publish,,,1,0,Never,2017-07-22 11:21,50 Rideau St,Ottawa,Ontario,Canada,,45.4250977,-75.6912497,Byward Market,45.4272431,-75.694269,,18557314555,info@squishcandies.com,http://www.squishcandies.com,https://twitter.com/SquishCandy,https://www.facebook.com/squishcandy/,,,,,"Vegan,Vegetarian",Get Directions,,,,0,,0,https://ethicaltree.com/wp-content/uploads/2017/07/2177_squish.jpg,https://ethicaltree.com/wp-content/uploads/2017/07/10431200_1556362931245551_3120636625051351684_o.jpg,,,,,,,,,,,,,,,,,,,,,,,,,,,,,,,,,,,,,,,,
2179,Viet Taste,5,"Some of the best vegan pho in town. It's not listed specifically on the menu, but you can ask for veggie broth, tofu and vegetables. Make sure you to tell them not to add fish sauce.

Other good veg options include salad rolls and spring rolls. Check with servers to confirm ingredients first.",Restaurants,Restaurants,"Best Asian Restaurants with Vegan and Vegetarian Options in Ottawa,Pho,Viet Taste,Vietnamese Restaurant",gd_place,publish,,,1,0,Never,2017-07-22 11:33,1399 Wellington St W,Ottawa,Ontario,Canada,,45.3981529,-75.7400206,Westboro,45.3922459,-75.7532734,,6136959889,,,,https://www.facebook.com/pages/Viet-Taste/665528553558990,,,,,"Vegan,Vegetarian",Get Directions,,,,0,,0,https://ethicaltree.com/wp-content/uploads/2017/07/2179_viet.jpg,https://ethicaltree.com/wp-content/uploads/2017/07/2179_viet2.jpg,,,,,,,,,,,,,,,,,,,,,,,,,,,,,,,,,,,,,,,,
2181,KS on the Keys Restaurant / Bar / Catering,5,"With our devotion to excellent customer service and diverse dishes, we guarantee a unique dining experience every time.  

The diversity of KS starts with our community. We are a traditional restaurant with a modern twist to a variety of cuisines. We are a welcoming environment for family outings, a modern feel for   ladies night ,  a hang out for boys night, or if you need a private setting for corporate meetings and gatherings. Join us for an unforgettable dining experience.

KS on the Keys…
Something for Everyone!

Most salads and stir-fries can be made vegan upon request. <strong>NEW:</strong> Any meatless pizza can now be made vegan by substituting cheese for vegan cheese (Earth Island).",Restaurants,Restaurants,"Best Sit-Down Restaurants in Ottawa,Caterer,Family,KS,Pizza,Restaurants",gd_place,publish,,,1,0,Never,2017-07-22 11:52,1029 Dazé St,Ottawa,Ontario,Canada,,45.3532996,-75.6521042,Ottawa South,45.3807492,-75.6703238,,6135210498,katrina@ksrestaurant.ca,http://www.ksonthekeys.com,https://twitter.com/KSOnTheKeys,https://www.facebook.com/KS-on-the-Keys-Restaurant-Bar-Catering-332760556796458/,,,,KS originally started by woman. Ottawa location run by Katrina.,"Vegan,Vegetarian",Get Directions,,,,0,,0,https://ethicaltree.com/wp-content/uploads/2017/07/2181_ks.png,https://ethicaltree.com/wp-content/uploads/2017/07/887375_882121871860321_1862825532628603466_o.jpg,,,,,,,,,,,,,,,,,,,,,,,,,,,,,,,,,,,,,,,,
2183,Mad Radish (Albert & Metcalfe),5,"At Mad Radish, we believe that people want to eat food that makes them feel great. But we don’t see why healthy should be boring. So we’ve created a menu of chef-driven, goodness-packed salads and warm bowls that taste as good as they make you feel.",Restaurants,Restaurants,"Best Places to Work and Study in Ottawa,Healthy,Healthy Vegan and Vegetarian Restaurants in Ottawa,Mad Radish,Restaurants,Vegan,XF",gd_place,publish,1,,2,0,Never,2018-02-16 23:24,116 Albert St,Ottawa,Ontario,Canada,,45.4213097,-75.6966232,centretown-1-1-1,45.4133828,-75.6943837,,,hello@madradish.com,http://www.madradish.com,https://twitter.com/eatmadradish,https://www.facebook.com/eatmadradish/,,,,Owned by owner of David's Tea,"Vegan,Vegetarian",Get Directions,eatmadradish,,,1,"claimed,gd_placecategory,geodir_email,geodir_ethicalcriteria,geodir_backendextrainfo,geodir_facebook,post_desc,geodir_menu,geodir_twitter,geodir_website",0,https://ethicaltree.com/wp-content/uploads/2017/10/2183_20690364_766034093569470_5457617090244168290_o-1.jpg,https://ethicaltree.com/wp-content/uploads/2017/07/2183_madrad.jpg,https://ethicaltree.com/wp-content/uploads/2017/10/2183_20451997_760946947411518_8996682083953054723_o-1.jpg,https://ethicaltree.com/wp-content/uploads/2017/10/2183_22180035_795592323946980_7458563660341782861_o-1.jpg,https://ethicaltree.com/wp-content/uploads/2017/07/19702782_747608155412064_7779632492260986471_o.jpg,,,,,,,,,,,,,,,,,,,,,,,,,,,,,,,,,,,,,
2185,Mad Radish (Glebe),5,"At Mad Radish, we believe that people want to eat food that makes them feel great. But we don’t see why healthy should be boring. So we’ve created a menu of chef-driven, goodness-packed salads and warm bowls that taste as good as they make you feel.",Restaurants,Restaurants,"Best Places to Work and Study in Ottawa,Healthy,Healthy Vegan and Vegetarian Restaurants in Ottawa,Mad Radish,Restaurant,Restaurants,Vegan,XF",gd_place,publish,1,,2,0,Never,2018-02-10 4:02,859 Bank St,Ottawa,Ontario,Canada,,45.4012667,-75.6873503,The Glebe,45.3993494,-75.6853936,,,hello@madradish.com,http://www.madradish.com,https://twitter.com/eatmadradish,https://www.facebook.com/eatmadradish/,,,,Owned by owner of David's Tea,"Vegan,Vegetarian",Get Directions,eatmadradish,,,0,,2183,https://ethicaltree.com/wp-content/uploads/2017/07/2185_madrad.jpg,https://ethicaltree.com/wp-content/uploads/2017/10/2185_2183_20451997_760946947411518_8996682083953054723_o-1.jpg,https://ethicaltree.com/wp-content/uploads/2017/10/2185_2183_20690364_766034093569470_5457617090244168290_o-1.jpg,https://ethicaltree.com/wp-content/uploads/2017/10/2185_2183_22180035_795592323946980_7458563660341782861_o-1.jpg,https://ethicaltree.com/wp-content/uploads/2017/10/2185_19702782_747608155412064_7779632492260986471_o.jpg,,,,,,,,,,,,,,,,,,,,,,,,,,,,,,,,,,,,,
2187,Paradise Poké,5,"Aloha from Paradise!

We get it. You want something clean, healthy and tasty. Us too!

From our chef-crafted menu, innovative vegan options to our build-your-own bowls, we’re all about fresh ingredients, high quality protein and a boatload of flavour.

Escape your routine. Come to Paradise.",Restaurants,Restaurants,"Hawaii,Hawaiian,Healthy,Healthy Vegan and Vegetarian Restaurants in Ottawa,Paradise",gd_place,publish,,,1,0,Never,2017-09-05 9:00,134 Bank St,Ottawa,ON,Canada,,45.4190622,-75.69971,centretown-1-1,45.4190622,-75.69971,Opening late August,,aloha@paradisepoke.ca,http://paradisepoke.ca,,https://www.facebook.com/ParadisePokeOttawa/,,,,Woman-owned?,"Vegan,Vegetarian",Get Directions,,,,0,,0,https://ethicaltree.com/wp-content/uploads/2017/07/2187_Poke2.jpg,https://ethicaltree.com/wp-content/uploads/2017/07/19029693_224814354692114_2997530241803834979_n.jpg,,,,,,,,,,,,,,,,,,,,,,,,,,,,,,,,,,,,,,,,
2189,Choux-Choux,5,"Salads, Buddha Bowls, soups and desserts. Local produce with many vegetarian, vegan and gluten-free options.

Salades, bols Buddha, soupes et desserts. Espressos et cafés spécialisés. Produits locaux. Options vegan et végétariennes et sans gluten.",Restaurants,Restaurants,"Best Woman-owned Restaurants in Ottawa,Choux-Choux,coffee,dessert,Local,Salad,Vegan",gd_place,publish,,,1,0,Never,2017-07-22 16:32,98 Rue de l'Hôtel-de-Ville,Gatineau,Québec,Canada,,45.427478,-75.7151103,Gatineau,45.4903494,-75.70759277,,8197718182,saladeschouxchoux@gmail.com,http://Chouxchoux.ca,https://twitter.com/chouxchouxsalad,https://www.facebook.com/chouxchouxsalads/,,,,Gabie Sexton owner?,"Vegan,Vegetarian,Woman-owned,Organic",Get Directions,,,,0,,0,https://ethicaltree.com/wp-content/uploads/2017/07/20247740_1499323256793701_3192569619640267279_o.jpg,https://ethicaltree.com/wp-content/uploads/2017/07/13920806_1154899944569369_5178849132175437691_n.png,,,,,,,,,,,,,,,,,,,,,,,,,,,,,,,,,,,,,,,,
2191,The Bowl,5,"The Bowl is a fast casual one dish concept, Yes, yes, you read that right, we only offer one dish.
Delicious and nutritious, The Bowl offers a whole meal that happens to be vegetarian, gluten free, nut free, hydrogenated oil free and can be vegan. 
Our Kiki sauce (totally addictive) is homemade right down to the toasting of our own spices.  It is then served over brown rice, beans, salsa, sour cream, cheddar cheese, avocado, cilantro and topped with house roasted crispy chickpeas. 

We got ya covered, no pesky lunch decisions to be made! 
#onetastydish",Restaurants,Restaurants,"Best Vegan and Vegetarian Restaurants for Grab-and-Go Lunches in Ottawa,Bowl,gluten-free,Restaurants,Vegan",gd_place,publish,,,1,0,Never,2017-07-23 15:14,83 Holland Ave,Ottawa,Ontario,Canada,,45.4009221,-75.7323552,Westboro,45.3922459,-75.7532734,,6137295454,info@thebowlottawa.ca,http://thebowlottawa.ca/,https://twitter.com/thebowlottawa,https://www.facebook.com/thebowlottawa/,,,,Owners Kristy Gaetz and Amy Munro,"Vegan,Vegetarian,Woman-owned",Get Directions,,,,0,,0,https://ethicaltree.com/wp-content/uploads/2017/07/2191_bowl.jpg,https://ethicaltree.com/wp-content/uploads/2017/07/17862568_1008474462585843_2355118553377894907_n.jpg,,,,,,,,,,,,,,,,,,,,,,,,,,,,,,,,,,,,,,,,
2194,"Sutherland Restaurant, Bar and Coffee House",5,"Sutherland restaurant, bar and café is nestled on the ground floor of the new Kavanaugh condo building on Beechwood Avenue.

Sutherland is a chef-driven neighbourhood restaurant. It is the namesake of Chef Warren Sutherland, an award-winning chef who has brought several acclaimed restaurants to the Ottawa restaurant scene. We capture Canada’s diverse culture of food with influences of South America, Asia, Europe and the Caribbean island, notably from Chef Sutherland Jamaican heritage.

Sutherland restaurant features a scratch kitchen, along with using local ingredients where ever possible. Great vegan options including the Crispy Smokie Bean Curd and the lunch veggie burger. The chef is always happy to find vegan alternatives to offer for other menu items.",Restaurants,Restaurants,"Best Sit-Down Restaurants in Ottawa,Caribbean,coffee,Jamaican,Restaurants",gd_place,publish,,,1,0,Never,2017-07-23 15:47,224 Beechwood Ave,Ottawa,Ontario,Canada,,45.4435916,-75.6701562,Vanier,45.4423308,-75.6714982,,6137417980,sutherland.rbc@gmail.com,http://sutherlandrestaurant.com/,https://twitter.com/sutherland_rbc,https://www.facebook.com/sutherlandrestaurant/,,,,Owner Warren M Sutherland,"Vegan,Vegetarian",Get Directions,,,,0,,0,https://ethicaltree.com/wp-content/uploads/2017/07/2194_suth.jpg,https://ethicaltree.com/wp-content/uploads/2017/07/10683527_982190961846730_8122073936238141792_o.jpg,,,,,,,,,,,,,,,,,,,,,,,,,,,,,,,,,,,,,,,,
2196,The Grill Next Door,5,"A great burger.  Perfect crispy fries.  All local and handmade.

Vegan buns with portobello or tempeh vegan options.",Food Trucks,Food Trucks,"Best Vegan and Vegetarian Burgers in Ottawa,Best Vegan and Vegetarian Restaurants for Grab-and-Go Lunches in Ottawa,Burgers,Food Truck,foodtruck,Grill,Tacos",gd_place,publish,,,1,0,Never,2017-07-23 16:03,541 Rideau St,Ottawa,ON,Canada,,45.43236,-75.67775,byward-market-1-1,45.4271129,-75.6892944,,6132973795,jess@thegrillnextdoor.ca,http://thegrillnextdoor.ca,http://www.twitter.com/thegrillnxtdoor,https://www.facebook.com/thegrillnextdoor.ca/,,,,Owned by Jess,"Vegan,Vegetarian,Woman-owned",Get Directions,,,,0,,0,https://ethicaltree.com/wp-content/uploads/2017/07/2196_GrillNExtd.jpg,https://ethicaltree.com/wp-content/uploads/2017/07/19956235_1366241716745561_4068405940815174676_o.jpg,,,,,,,,,,,,,,,,,,,,,,,,,,,,,,,,,,,,,,,,
2199,La Cocina Loca,5,"A fabulous cozy little Fresh-Mex Taqueria in the heart of Hintonburg serving fresh lumpy Guacamole, chilled Mexican Beer, homemade Corn Tortillas, squeezed Lime Margaritas, the most amazing Tacos ever...plus so much more homemade Mexican traditional foods, all in a funky little hole-in-the-wall on Wellington West !!

Many vegetarian tacos which can be veganized without sour cream and cheese.",Restaurants,Restaurants,"Best Mexican Restaurants with Vegan and Vegetarian Options in Ottawa,Cocina,gluten-free,Margaritas,Mexican,Restaurants,Salsa",gd_place,private,,,1,0,Never,2017-07-23 16:28,1079 Wellington St W,Ottawa,Ontario,Canada,,45.4034203,-75.7251871,Westboro,45.3922459,-75.7532734,,6137989292,olacocinahinto@gmail.com,http://wellingtonwest.ca/business-directory/la-cocina-loca.htm,,https://www.facebook.com/olacocinahinto/,,,,,"Vegan,Vegetarian",Get Directions,,,,0,,0,https://ethicaltree.com/wp-content/uploads/2017/07/2199_taco.jpg,https://ethicaltree.com/wp-content/uploads/2017/07/17309657_1839947819550458_5661431472622473896_n.jpg,,,,,,,,,,,,,,,,,,,,,,,,,,,,,,,,,,,,,,,,
2288,Pure Gelato (Glebe),5,"At Pure Gelato we make authentic Italian gelato using only the freshest, all natural ingredients. We follow traditional artisan recipes and import our pastes and concentrates straight from Italy.Our gelato is low in fat (4-6% MF) but just as smooth and creamy as other premium ice creams with higher fat contents (18-24% MF). We also offer vegan and gluten free options. All our flavours are made daily right here in the store! Our gelato artist was trained in Italy and has been making gelato for more than 20 years.
If a frozen treat isn't your thing, stop by and try our sweet or savoury crepes, and our delicious pastries and chocolates. Or grab a Segafredo coffee and Italian panini for lunch.

For Vegans, Pure Gelato offers soy-based gelatos and vegan ice creams such as hazelnut, chocolate, and organic vanilla. Ask the staff for vegan options.",Cafés and Bakeries,Cafés and Bakeries,"Best Vegan and Vegetarian Desserts Pastries and Treats in Ottawa,Crêpes,Gelato,Ice Cream,Italian",gd_place,publish,,,1,0,Never,2017-07-26 17:02,843 Bank St,Ottawa,Ontario,Canada,,45.4018924,-75.6875383,The Glebe,45.3993494,-75.6853936,,6135675900,gelatopure@gmail.com,,,https://www.facebook.com/PureGelatoBank/,,,,,"Vegan,Vegetarian,Organic",Get Directions,,,,0,,1057,https://ethicaltree.com/wp-content/uploads/2017/07/2288_21373_494245930620826_1357874316_n.jpg,https://ethicaltree.com/wp-content/uploads/2017/07/2288_332072_494254823953270_1467377162_o.jpg,,,,,,,,,,,,,,,,,,,,,,,,,,,,,,,,,,,,,,,,
2342,Voila Gluten Free Bakeree Ottawa,5,"We are a new Gluten Free, Peanut & Nut Free Bakery in Kanata North. We cater to people with Celiac disease and those with dairy allergies. Many vegan baked good options.",Cafés and Bakeries,Cafés and Bakeries,"Bakery,Bread,gluten-free,Nut-free,Vegan",gd_place,publish,,,1,0,Never,2017-07-27 20:37,4055 Carling Avenue Unit 2,Ottawa,Ontario,Canada,,45.338728,-75.9075029,Kanata,45.3538988,-75.9319726,,6135925959,ottawa@voilaglutenfreebakeree.com,http://www.voilaglutenfreebakeree.com,,https://www.facebook.com/voilaottawa/,,,,"Family-owned: John, Julia, Ryan, Kaleigh","Vegan,Vegetarian,Woman-owned",Get Directions,,,,0,,0,https://ethicaltree.com/wp-content/uploads/2017/07/2342_voila.jpg,https://ethicaltree.com/wp-content/uploads/2017/07/17329_788616891214514_6600509742703700959_n.png,,,,,,,,,,,,,,,,,,,,,,,,,,,,,,,,,,,,,,,,
2345,Maverick's Donut Company,5,"Five childhood friends open a donut shop.
Custom cake donuts
Yeast donuts
Cronuts
Ice cream
Beer and wine

Vegan donut options including including maple and coconut!

Delivery is $10 for orders under $75 within 25 km from our location.

Online ordering coming soon.",Cafés and Bakeries,Cafés and Bakeries,"Bakery,Best Vegan and Vegetarian Desserts Pastries and Treats in Ottawa,Cafe,dessert,Donuts,Vegan",gd_place,publish,,,1,0,Never,2017-07-31 0:05,1500 Bank St,Ottawa,Ontario,Canada,,45.3807492,-75.6703238,Ottawa South,45.3807492,-75.6703238,,6136801004,info@mavericksdonuts.com,http://www.mavericksdonuts.com,,https://www.facebook.com/mavericksdonuts/,,,,,"Vegan,Vegetarian",Get Directions,,,,0,,0,https://ethicaltree.com/wp-content/uploads/2017/07/2345_Screen-Shot-2017-07-31-at-12.58.18-PM.png,https://ethicaltree.com/wp-content/uploads/2017/07/14612594_175193142925820_4343095136840730046_o.jpg,,,,,,,,,,,,,,,,,,,,,,,,,,,,,,,,,,,,,,,,
2351,Stella Luna Gelato Café (Glebe),5,"More than just gelato, Stella Luna is a family owned and operated European style Café, serving up gourmet panini, hearty soups, eclectic salads, buttermilk waffles, crepes, decadent desserts and specialty coffees with Italian flare. Stella Luna - intimate ambiance, exceptional food!

Sorbets are all vegan but most gelatos contain dairy and sometimes egg. Staff are helpful to let you know which options are vegetarian and vegan.",Other,Other,"Gelato,Ice Cream,Sorbet",gd_place,publish,,,1,0,Never,2017-07-30 17:13,1103 Bank Street,Ottawa,Ontario,Canada,,45.3939113,-75.6830647,The Glebe,45.3993494,-75.6853936,,6135231116,tammy@slgelato.com,http://www.slgelato.com,,https://www.facebook.com/Stella-Luna-Gelato-Café-139242796160287/,,,,Owner: Tammy Guiliani,"Vegan,Vegetarian,Woman-owned",Get Directions,,,,1,"claimed,geodir_timing,gd_placecategory,geodir_email,geodir_ethicalcriteria,geodir_backendextrainfo,geodir_facebook,post_desc,geodir_menu,geodir_contact,post_tags,geodir_twitter,geodir_website",0,https://ethicaltree.com/wp-content/uploads/2017/07/1010390_584975454920350_771175663_n.jpg,https://ethicaltree.com/wp-content/uploads/2017/07/1074844_493454584072438_1819190313_o.jpg,,,,,,,,,,,,,,,,,,,,,,,,,,,,,,,,,,,,,,,,
2353,Stella Luna Gelato Café (Hintonburg),5,"More than just gelato, Stella Luna is a family owned and operated European style Café, serving up gourmet panini, hearty soups, eclectic salads, buttermilk waffles, crepes, decadent desserts and specialty coffees with Italian flare. Stella Luna - intimate ambiance, exceptional food!

Sorbets are all vegan but most gelatos contain dairy and sometimes egg. Staff are helpful to let you know which options are vegetarian and vegan.",Other,Other,"Gelato,Ice Cream,Sorbet",gd_place,publish,,,1,0,Never,2017-07-30 17:15,1130 Wellington St W,Ottawa,Ontario,Canada,,45.4017503,-75.7267089,Hintonburg,45.4017503,-75.7267089,,6135231116,tammy@slgelato.com,http://www.slgelato.com,,https://www.facebook.com/Stella-Luna-Gelato-Café-139242796160287/,,,,Owner: Tammy Guiliani,"Vegan,Vegetarian,Woman-owned",Get Directions,,,,0,,2351,https://ethicaltree.com/wp-content/uploads/2017/07/2353_1010390_584975454920350_771175663_n.jpg,https://ethicaltree.com/wp-content/uploads/2017/07/2353_1074844_493454584072438_1819190313_o.jpg,,,,,,,,,,,,,,,,,,,,,,,,,,,,,,,,,,,,,,,,
