post_id,post_title,post_author,post_content,post_category,default_category,post_tags,post_type,post_status,is_featured,claimed,package_id,alive_days,expire_date,post_date,post_address,post_city,post_region,post_country,post_zip,post_latitude,post_longitude,post_neighbourhood,neighbourhood_latitude,neighbourhood_longitude,geodir_timing,geodir_contact,geodir_email,geodir_website,geodir_twitter,geodir_facebook,geodir_video,geodir_special_offers,linked_cpt_ID,geodir_backendextrainfo,geodir_ethicalcriteria,geodir_get_directions,geodir_twitterusername,geodir_Instagram,geodir_Calltoaction,gd_is_franchise,gd_franchise_lock,franchise,IMAGE,IMAGE,IMAGE,IMAGE,IMAGE,IMAGE,IMAGE,IMAGE,IMAGE,IMAGE,IMAGE,IMAGE,IMAGE,IMAGE,IMAGE,IMAGE,IMAGE,IMAGE,IMAGE,IMAGE,IMAGE,IMAGE,IMAGE,IMAGE,IMAGE,IMAGE,IMAGE,IMAGE,IMAGE,IMAGE,IMAGE,IMAGE,IMAGE,IMAGE,IMAGE,IMAGE,IMAGE,IMAGE,IMAGE,IMAGE,IMAGE,IMAGE
1057,Pure Gelato (Elgin),261,"At Pure Gelato we make authentic Italian gelato using only the freshest, all natural ingredients. We follow traditional artisan recipes and import our pastes and concentrates straight from Italy.Our gelato is low in fat (4-6% MF) but just as smooth and creamy as other premium ice creams with higher fat contents (18-24% MF). We also offer vegan and gluten free options. All our flavours are made daily right here in the store! Our gelato artist was trained in Italy and has been making gelato for more than 20 years.
If a frozen treat isn't your thing, stop by and try our sweet or savoury crepes, and our delicious pastries and chocolates. Or grab a Segafredo coffee and Italian panini for lunch.

For Vegans, Pure Gelato offers soy-based gelatos and vegan ice creams such as hazelnut, chocolate, and organic vanilla. Ask the staff for vegan options.",Cafés and Bakeries,Cafés and Bakeries,"Best Vegan and Vegetarian Desserts Pastries and Treats in Ottawa,Crêpes,Gelato,Ice Cream,Italian",gd_place,publish,,,1,0,Never,2016-06-26 15:46,350 Elgin St.,Ottawa,Ontario,Canada,,45.4155177,-75.6885161,centretown-1,45.4153258,-75.6967715,"Mon-Wed:	 11:00 - 23:00 Thurs-Sat:	 11:00 - 23:30 Sun:	 11:00 - 23:00",6132373799,gelatopure@gmail.com,,,https://www.facebook.com/Pure-Gelato-456145071097579/,,,,,"Vegan,Vegetarian,Organic",Get Directions,,,,1,"claimed,gd_placecategory,geodir_email,geodir_ethicalcriteria,geodir_backendextrainfo,post_desc,geodir_menu,post_tags,geodir_twitter,geodir_website",0,https://ethicaltree.com/wp-content/uploads/2016/08/1057_521373_494245930620826_1357874316_n.jpg,https://ethicaltree.com/wp-content/uploads/2016/06/332072_494254823953270_1467377162_o.jpg,,,,,,,,,,,,,,,,,,,,,,,,,,,,,,,,,,,,,,,,
1059,Horn of Africa,261,"Delicious Ethiopian food. Mostly known for injera dishes, which include a large, spongy flatbread. You rip off pieces of injera with your hands and it eat with the fillings (veg or meat). The injeras and vegetable stews are vegan - but some vegetarian options come with egg, so be sure to ask.",Restaurants,Restaurants,"Africa,Ethiopia,Injerra,Restaurant,Veg-friendly",gd_place,publish,,,1,0,Never,2016-06-26 16:56,"364 Rideau St  Ottawa, ON",Ottawa,Ontario,Canada,,45.4297592,-75.683424,Byward Market,45.4272431,-75.694269,"Mon - Sun:	11:00 - 23:00",6137890025,,,,https://www.facebook.com/pages/Horn-of-Africa/150943604962536,,,,,"Vegan,Vegetarian",Get Directions,,,,0,,0,https://ethicaltree.com/wp-content/uploads/2017/03/1059_15138507_1826869414261020_6153673745074012526_o.jpg,https://ethicaltree.com/wp-content/uploads/2016/06/1059_Horn.jpg,,,,,,,,,,,,,,,,,,,,,,,,,,,,,,,,,,,,,,,,
1061,Lemon Grass Ottawa,261,"Ottawa Thai Restaurant with many vegetarian and vegan options, especially using tofu and eggplant.",Restaurants,Restaurants,"Best Asian Restaurants with Vegan and Vegetarian Options in Ottawa,Best Sit-Down Restaurants in Ottawa,Lemon Grass,Restaurant,thai,tofu",gd_place,publish,,,1,0,Never,2016-06-26 17:07,331 Elgin Street,Ottawa,Ontario,Canada,,45.4159359,-75.688541,Centretown,45.41996677,-75.6932603,Mon-Wed 11-2:30 and 4:30-10pm; Thurs-Fri 11-2:30 and 4:30-11pm; Sat 12-2:30 and 4:30-11pm; Sun 4:30-10pm,6132335000,ottawalemongrass@yahoo.com,http://www.ottawalemongrass.com,https://twitter.com/LemonGrassElgin,https://www.facebook.com/Lemon-Grass-Ottawa-145485352241032/,,,,,"Vegan,Vegetarian",Get Directions,LemonGrassElgin,,,0,,0,https://ethicaltree.com/wp-content/uploads/2017/03/1061_427387_145486355574265_1116224733_n.jpg,https://ethicaltree.com/wp-content/uploads/2016/06/430202_145485605574340_43432522_n.jpg,,,,,,,,,,,,,,,,,,,,,,,,,,,,,,,,,,,,,,,,
1063,Habesha Restaurant Ottawa,261,"Habesha Restaurant located in the heart of downtown Ottawa serves authentic Ethiopian food, with many vegetarian and vegan options. Injera is vegan.",Restaurants,Restaurants,"Best Sit-Down Restaurants in Ottawa,Ethiopian,Restaurant,Vegetarian",gd_place,publish,,,1,0,Never,2016-06-26 17:29,"574 Rideau St, Ottawa, ON",Ottawa,Ontario,Canada,,45.4324734,-75.6763739,Sandy Hill,45.4257867,-75.68156,"Mon-Thurs:	 12:00 - 21:30 Fri-Sat:	 12:00 - 22:00 Sun:	 12:00 - 21:30",6137616120,,,,https://www.facebook.com/ottawahabesha/,,,,,"Vegan,Vegetarian",Get Directions,,,,0,,0,https://ethicaltree.com/wp-content/uploads/2016/06/10930_802031159842352_856673928333787264_n.jpg,https://ethicaltree.com/wp-content/uploads/2016/06/10624983_802024933176308_3724968232322478906_n.jpg,,,,,,,,,,,,,,,,,,,,,,,,,,,,,,,,,,,,,,,,
1065,Shanghai Restaurant,261,"The Shanghai Restaurant, established in 1971 . Ottawa Chinatown’s first pioneering Chinese restaurant. A family owned and operated business serving great homemade Asian inspired fair in an eclectic dining atmosphere. Call ahead as it is often closed for community events and fundraisers.

Many vegetarian and vegan dishes, mostly with tofu.",Restaurants,Restaurants,"Best Asian Restaurants with Vegan and Vegetarian Options in Ottawa,Karaoke,Restaurant,Shanghai,thai",gd_place,publish,,,1,0,Never,2016-06-26 17:34,651 Somerset Street West,Ottawa,Ontario,Canada,,45.4118284,-75.7052224,Chinatown,45.409151,-75.7112239,"Wed:	 11:30 - 22:00 Thurs:	 16:30 - 22:00 Fri:	 11:30 - 22:00 Sat:	 16:30 - 02:00 Sun:	 16:30 - 22:00",6132334001,theshanghaiottawa@gmail.com,https://shanghairestaurantottawa.com,https://twitter.com/theshangrest,https://www.facebook.com/ShanghaiRestaurantOttawa/,,,,family-owned,"Vegan,Vegetarian",Get Directions,theshangrest,,,0,,0,https://ethicaltree.com/wp-content/uploads/2017/03/1065_12747506_1297944903564593_4113318191453434279_o.jpg,,,,,,,,,,,,,,,,,,,,,,,,,,,,,,,,,,,,,,,,,
1067,Light of India Restaurant,261,"Conveniently located in the heart of the Glebe, a vibrant Ottawa downtown neighborhood, Light of India Restaurant offers a unique Indian gastronomic experience. The warmly lit restaurant features a daily luncheon and Sunday brunch buffet, and an à la carte dinner menu of traditional dishes from the northeastern region of India . With lots of fine choices, the flavourful menu also includes a number of combination platters and dishes perfect for sharing and sampling.

Many vegetarian and vegan dishes with curries, chickpeas, okra, eggplant, mushrooms, cauliflower, lentils and more.",Restaurants,Restaurants,"Best Indian Restaurants with Vegetarian and Vegan options (Ottawa),Buffet,Indian,Restaurant",gd_place,publish,,,1,0,Never,2016-06-26 17:56,730 Bank St,Ottawa,Ontario,Canada,,45.4040929,-75.6891398,The Glebe,45.3993494,-75.6853936,Mon-Sun 11:30am-2pm and 5pm-10pm,6135634411,Barnali.deb@gmail.com,http://www.lightofindia.ca,,https://www.facebook.com/Light-of-India-Restaurant-124176500957943/,,,,,"Vegan,Vegetarian",Get Directions,,,,0,,0,https://ethicaltree.com/wp-content/uploads/2016/06/12986964_1095788830463367_4755159555901023780_n.jpg,,,,,,,,,,,,,,,,,,,,,,,,,,,,,,,,,,,,,,,,,
1069,The Joy of Gluten Free (Downtown),261,"The Joy of Gluten Free prepares fabulous food everybody loves. We vow to achieve the highest standards in both taste and nutrition.

We offer a daily lunch menu as well as our fresh baked breads, buns, pizza crusts, cakes, pies, sweets and pastries all made on the premises. For cooks there is a selection of pastas, our bread crumbs, our all-purpose flour mix and gourmet items. We also carry many items that are for dairy free, egg free, and vegan lifestyles.

We are 100 % gluten free and peanut free facility. We use almonds in some of our baking but they have never come into contact with peanuts. We do not use any soy oil or soy flour. We use hershey's chocolate and crystal lactose free margarine in some products; both these contain a bit of soy lecithin.",Cafés and Bakeries,Cafés and Bakeries,"Bakery,Best Vegan and Vegetarian Desserts Pastries and Treats in Ottawa,gluten-free,Vegan",gd_place,publish,,,1,0,Never,2016-06-26 18:05,625 Bank St,Ottawa,Ontario,Canada,,45.4072258,-75.6904607,The Glebe,45.3993494,-75.6853936,Open 10-6 Tuesday - Saturday Open 11-4 Sundays Closed Mondays,6136565252,thejoyofglutenfree@gmail.com,http://www.thejoyofglutenfree.com,https://twitter.com/JoyofGlutenFree,https://www.facebook.com/thejoyofglutenfree/,,,,Owned by Susan Phipps,"Vegan,Vegetarian,Woman-owned",Get Directions,JoyofGlutenFree,,,1,"claimed,gd_placecategory,geodir_email,geodir_ethicalcriteria,geodir_backendextrainfo,geodir_facebook,post_desc,geodir_menu,geodir_twitter,geodir_website",0,https://ethicaltree.com/wp-content/uploads/2017/03/1069_17155852_1421127081293077_117712668768115517_n.jpg,,,,,,,,,,,,,,,,,,,,,,,,,,,,,,,,,,,,,,,,,
1071,The Joy of Gluten Free (West End),261,"The Joy of Gluten Free prepares fabulous food everybody loves. We vow to achieve the highest standards in both taste and nutrition.

We offer a daily lunch menu as well as our fresh baked breads, buns, pizza crusts, cakes, pies, sweets and pastries all made on the premises. For cooks there is a selection of pastas, our bread crumbs, our all-purpose flour mix and gourmet items. We also carry many items that are for dairy free, egg free, and vegan lifestyles.

We are 100 % gluten free and peanut free facility. We use almonds in some of our baking but they have never come into contact with peanuts. We do not use any soy oil or soy flour. We use hershey's chocolate and crystal lactose free margarine in some products; both these contain a bit of soy lecithin.",Cafés and Bakeries,Cafés and Bakeries,"Bakery,gluten-free,Vegan",gd_place,publish,,,1,0,Never,2016-06-26 18:07,250 Greenbank Rd,Ottawa,Ontario,Canada,,45.3247505,-75.7797931,Bells Corners,45.33061,-75.78296,Monday  11AM - 6PM Tuesday to Saturday 10AM - 6PM Sunday  11AM - 5PM,6139071252,thejoyofglutenfree@gmail.com,http://www.thejoyofglutenfree.com,https://twitter.com/JoyofGlutenFree,https://www.facebook.com/thejoyofglutenfree/,,,,Owned by Susan Phipps,"Vegan,Vegetarian,Woman-owned",Get Directions,JoyofGlutenFree,,,0,,1069,https://ethicaltree.com/wp-content/uploads/2016/06/1071_10256451_669510503121409_7189077461000566852_n.jpg,https://ethicaltree.com/wp-content/uploads/2016/06/1071_134994_115896118482853_7855656_o.jpg,,,,,,,,,,,,,,,,,,,,,,,,,,,,,,,,,,,,,,,,
1074,Taj Indian Cuisine,261,"Taj Indian Cuisine is a family owned restaurant that opened in 1987 and has remained a fixture in Ottawa for nearly 28 years.

North Indian Punjabi style cooking prepared from a selection of innovative recipes created by owner Indu Bakshi.

We understand the ways of life and try our best to accommodate by serving to our clients needs whether preferring gluten free, being a vegan, vegetarian or loving your meat!",Restaurants,Restaurants,"Best Indian Restaurants with Vegetarian and Vegan options (Ottawa),Best Vegan and Vegetarian Restaurants with Delivery in Ottawa,Indian,North Indian,Restaurant,Taj,Veg-friendly",gd_place,publish,,,1,0,Never,2016-06-26 18:16,3009 Carling Avenue,Ottawa,Ontario,Canada,,45.3552951,-75.8053613,Britannia,45.3552951,-75.8053613,"Mon-Fri:	 11:30 - 14:00 16:00 - 22:00 Sat:	 12:00 - 22:00 Sun:	 16:00 - 22:00",6137266955,info@tajindiancuisine.com,http://www.tajindiancuisine.com,https://twitter.com/tajottawa,https://www.facebook.com/TajIndianCuisine/,,,,Owner Indu Bakshi,"Vegan,Vegetarian,Woman-owned",Get Directions,tajottawa,,,0,,0,https://ethicaltree.com/wp-content/uploads/2017/03/1074_16700657_1251327161612524_2286284270745413280_o.jpg,https://ethicaltree.com/wp-content/uploads/2016/06/11246971_827731480638763_4125943367939562808_n.png,,,,,,,,,,,,,,,,,,,,,,,,,,,,,,,,,,,,,,,,
1081,"Dale Lockhart, Realtor",64,"Dale Lockhart is a local veg-friendly Realtor. She is formally trained as a registered nurse and has a Bachelor of science degree from the University of Ottawa. Dale's clients describe her as down to earth, hard working, caring and loyal. After years as a vegetarian, she adopted a vegan lifestyle in 2015.

Dale has lived in Ottawa her entire life. As a dedicated and reliable professional, she goes above and beyond to ensure her clients get exceptional service.

During her spare time, Dale is very active in Ottawa's vegetarian community. She frequently volunteers at various veg-friendly events in the city. She is also a competitive triathlete.

For every sale, Dale will donate a portion of her commission to an animal welfare organization of the client's choice. Dale can also refer clients to vegan service providers throughout Ottawa such as contractors, cleaners, etc.

You can contact Dale for any real estate needs at 613-898-5106 or dalelockhart@kw.com",Other,Other,"Real Estate,Realtor,Vegan",gd_place,private,,1,1,0,Never,2016-06-29 13:48,5 Corvus Ct,Ottawa,Ontario,Canada,,45.327605,-75.7127196,,,,8am-8pm,6138985106,dalelockhart@kw.com,http://kwsolidrock.com/,,,,,,,"Vegan,Vegetarian,Woman-owned",Get Directions,,,,0,,0,https://ethicaltree.com/wp-content/uploads/2016/06/1081_head-shot-1.jpg,,,,,,,,,,,,,,,,,,,,,,,,,,,,,,,,,,,,,,,,,
1083,Bar Robo,261,"Some say Ottawa is a predictable, robotic city. We’re here to prove them wrong. By day, Bar Robo serves premium coffee and specialty baked goods; by night it serves classic and modern libations and delicious bar snacks. We also like bringing people together with events, shows and parties.

Very good veg options for a bar/cafe, such as roasted carrots with vegan cream cheese, banana ketchup, peanuts &amp; pickled papaya.",Cafés and Bakeries,Cafés and Bakeries,"Bar,Cafe,February2017,Music,Robo",gd_place,publish,,,1,0,Never,2016-07-03 8:46,692 Somerset St. W,Ottawa,Ontario,Canada,,45.4110605,-75.706625,Chinatown,45.409151,-75.7112239,"Mon:	 08:00 - 02:00 Tues-Wed:	 08:00 - 18:00 Thurs-Sun:	 08:00 - 02:00",6132337626,barroboottawa@gmail.com,http://barrobo.com,https://twitter.com/bar_robo,https://www.facebook.com/Bar-Robo-1578733065780499/,,,,,"Vegan,Vegetarian",Get Directions,bar_robo,,,0,,0,https://ethicaltree.com/wp-content/uploads/2017/03/1083_14915404_1728187414168396_7988115072162778117_n.jpg,https://ethicaltree.com/wp-content/uploads/2016/07/1977296_1585156495138156_5130558263100182628_n.jpg,,,,,,,,,,,,,,,,,,,,,,,,,,,,,,,,,,,,,,,,
1085,Lowertown Brewery,261,"Located in the ByWard Market in Ottawa, Lowertown Brewery is the newest addition to the Ontario craft beer market. Serving great comfort food and pre-prohibition cocktails, you won't want to miss what we're brewing next!

The head chef is former ZenKitchen chef Kyle Mortimer-Proulx and so there are always veg-friendly options available here. A few vegan choices are on the menu (clearly labelled as such) and you can always ask your server for other vegan options available that day.",Restaurants,Restaurants,"Bar,Best Sit-Down Restaurants in Ottawa,Brewery,Grill,Lowertown,Restaurant",gd_place,publish,,,1,0,Never,2016-07-03 10:37,73 York Street,Ottawa,Ontario,Canada,,45.4285859,-75.6918178,byward-market-1,45.4288038,-75.694015,"Mon-Wed:	 11:00 - 01:00 Thurs-Fri:	 11:00 - 02:00 Sat-Sun:	 10:00 - 02:00",6137221454,lowertownbrewery@gmail.com,http://lowertownbrewery.ca/,https://twitter.com/LowertownOttawa,https://www.facebook.com/LowertownBreweryOttawa/,,,,,"Vegan,Vegetarian",Get Directions,LowertownOttawa,,,0,,0,https://ethicaltree.com/wp-content/uploads/2017/03/1085_16708227_1852716381664992_6851135380857609144_n.jpg,https://ethicaltree.com/wp-content/uploads/2016/07/10174881_1405780179691950_606371409_n.jpg,,,,,,,,,,,,,,,,,,,,,,,,,,,,,,,,,,,,,,,,
1087,Bambu,261,"Thai, Chinese and Japanese creations transport your senses to the places where our meals find inspiration.

Many veg-friendly options on both the main menu (especially tofu-based items) and on the sushi menu, which features vegan sushi such as avocado, mushroom, cucumber, radish, asparagus, squash, sweet potato, tofu and more. Like many sushi places, miso soup is not vegan.",Restaurants,Restaurants,"Best Asian Restaurants with Vegan and Vegetarian Options in Ottawa,Best Sit-Down Restaurants in Ottawa,Chinese,Japanese,Restaurant,Sushi,thai",gd_place,publish,,,1,0,Never,2016-07-03 10:46,3993 Riverside Dr,Ottawa,Ontario,Canada,,45.33292866,-75.6927843,Ottawa South,45.3807492,-75.6703238,"Sunday	11:00 AM - 10:00 PM Mon - Wed	11:00 AM - 9:30 PM Thursday	11:00 AM - 10:00 PM Fri - Sat	11:00 AM - 11:00 PM",6137388800,,http://www.restobambu.com/,,https://www.facebook.com/pages/Bambu/160544970634498,,,,,"Vegan,Vegetarian",Get Directions,,,,0,,0,https://ethicaltree.com/wp-content/uploads/2016/07/1087_bambu.jpg,https://ethicaltree.com/wp-content/uploads/2016/07/1087_bambu2.png,,,,,,,,,,,,,,,,,,,,,,,,,,,,,,,,,,,,,,,,
1089,Talay Thai,261,"Delicious Thai food on the South side of Centretown.

Many vegan options throughout the lunch and dinner menus, mostly found under the ""Vegetables"" sections at the bottoms of both menus. Items such as tofu dishes and thai veg curries.",Restaurants,Restaurants,"Best Asian Restaurants with Vegan and Vegetarian Options in Ottawa,Curry,Featured Local Businesses For April 2017,Restaurant,Talay,thai,tofu,Veg",gd_place,publish,,,1,0,Never,2016-07-03 10:52,511 Bank Street,Ottawa,Ontario,Canada,,45.4100413,-75.6921098,Centretown,45.41996677,-75.6932603,Lunch: Monday - Friday 11:30 AM - 2:00 PM  Dinner: Sunday - Monday 5:00 PM - 9:00 PM Tuesday - Saturday 5:00 PM - 10:00 PM,6132382529,,http://www.talaythai.ca/,,https://www.facebook.com/pages/Talay-Thai/177827938920199,,,,,"Vegan,Vegetarian",Get Directions,,,,0,,0,https://ethicaltree.com/wp-content/uploads/2017/03/1089_11180295_10203783691542854_5629009981977050387_n.jpg,https://ethicaltree.com/wp-content/uploads/2016/07/1089_talay.jpg,,,,,,,,,,,,,,,,,,,,,,,,,,,,,,,,,,,,,,,,
1091,Phuket Royal,261,"Specialized in Thai Cuisine, Vietnamese Pho, Chinese B.B.Q and Filipino Lechon.

See items on the Vegetable Menu for some delicious vegan options with tofu, curried vegetables and more. Staff are very helpful if you tell them you're vegan.",Restaurants,Restaurants,"Best Asian Restaurants with Vegan and Vegetarian Options in Ottawa,Chinese,Filipino,October2016,Restaurant,Vietnamese",gd_place,publish,,,1,0,Never,2016-07-03 10:58,713 Somerset Street West,Ottawa,Ontario,Canada,,45.4107094,-75.707819,Chinatown,45.409151,-75.7112239,"Mon-Sun:	 11:00 - 22:00",6132353134,,http://www.phuketroyal.com,,https://www.facebook.com/Phuket-Royal-618880314873492/,,,,,"Vegan,Vegetarian",Get Directions,,,,0,,0,https://ethicaltree.com/wp-content/uploads/2017/03/1091_10417563_772803996147789_7903046896548033417_n.jpg,https://ethicaltree.com/wp-content/uploads/2016/07/1504547_618881421540048_576705749_n.jpg,,,,,,,,,,,,,,,,,,,,,,,,,,,,,,,,,,,,,,,,
1093,House of TARG,261,"It's a spot like no other, featuring the best in live music, pinball, old school arcade games and a delicious menu of handmade perogies. The House of TARG is proudly owned and operated by Ottawa musicians Paul ‘yogi’ Granger, Mark McHale and Kevin Birger.

Known for great vegan “cheddar bacon” perogies, served with cashew dill “sour cream” and sauerkraut. The weekend brunch menu features a vegan platter with those perogies along with fruit, toast and unlimited coffee.",Restaurants,Restaurants,"Arcade,Bands,Best Vegan and Vegetarian Breakfast and Brunch Spots in Ottawa,f07,Music,Perogies,Restaurant",gd_place,publish,,,1,365,2018-02-06,2016-07-03 11:04,1077 Bank Street,Ottawa,Ontario,Canada,,45.3945333,-75.6834339,Old Ottawa South,45.393166,-75.6824865,Mon & Tues: Closed* Wed: 5pm - 11pm Thurs & Fri: 5pm - 2am Sat & Sun: 11am - 2am,6136808274,yogi@houseoftarg.com,http://www.houseoftarg.com,https://twitter.com/HouseofTarg,https://www.facebook.com/houseoftarghouseoftarg/,,,,,"Vegan,Vegetarian",Get Directions,HouseofTarg,,,0,,0,https://ethicaltree.com/wp-content/uploads/2017/03/1093_16825963_1461626093888189_2212659859064561534_o.jpg,https://ethicaltree.com/wp-content/uploads/2016/07/13312854_1165562380161230_2045962728851701652_n.png,,,,,,,,,,,,,,,,,,,,,,,,,,,,,,,,,,,,,,,,
1095,Kothu Rotti,261,"Associated with the popular Ceylonta restaurant owners, Kothu Rotti serves typical and traditional popular Sri Lankan and South Indian dishes. Vast varieties of dishes for Vegan, Vegetarian, Meat lovers (Halal), Sea food lovers, and special choices in Gluten free and Nuts free.

There is an entire menu section full of vegan appetizers and meals.",Restaurants,Restaurants,"Best Indian Restaurants with Vegetarian and Vegan options (Ottawa),Best Vegan and Vegetarian Restaurants with Delivery in Ottawa,Fast Food Restaurant,Indian,KOTHU ROTTI,Restaurant",gd_place,publish,,,1,0,Never,2016-07-03 11:22,408 Dalhousie Street,Ottawa,Ontario,Canada,,45.4265278,-75.6894165,Byward Market,45.4272431,-75.694269,"Mon-Thurs:	 09:30 - 21:30 Fri:	 09:30 - 22:30 Sat:	 15:30 - 22:30 Sun:	 15:30 - 21:00",6136807812,kothurotti01@gmail.com,http://www.kothurotti.ca,,https://www.facebook.com/KothuRotti/,,,,,"Vegan,Vegetarian",Get Directions,,,,0,,0,https://ethicaltree.com/wp-content/uploads/2017/03/1095_10296602_685207094848437_2443416932040920223_n.png,https://ethicaltree.com/wp-content/uploads/2016/07/1048848_549111348458013_1084972388_o.jpg,,,,,,,,,,,,,,,,,,,,,,,,,,,,,,,,,,,,,,,,
1099,Sidedoor Contemporary Kitchen & Bar,261,"Slightly upscale and contemporary restaurant in Byward Market that always has a few vegan options on the menu, though they change with the seasonal menus.",Restaurants,Restaurants,"Bar,Best Sit-Down Restaurants in Ottawa,Contemporary,Kitchen,Restaurant",gd_place,publish,,,1,0,Never,2016-07-03 11:38,18b York Street,Ottawa,Ontario,Canada,,45.4273346,-75.6940098,Byward Market,45.4272431,-75.694269,"Mon-Fri:	 11:30 - 14:30 16:30 - 02:00 Sat-Sun:	 16:30 - 02:00",6135629331,events@sidedoorrestaurant.com,http://www.sidedoorrestaurant.com/,https://twitter.com/sidedoorkitchen,https://www.facebook.com/Sidedoor-Contemporary-Kitchen-Bar-225595294122013/,,,,,"Vegan,Vegetarian",Get Directions,sidedoorkitchen,,,0,,0,https://ethicaltree.com/wp-content/uploads/2016/07/241323_229516743729868_2739114_o.jpg,https://ethicaltree.com/wp-content/uploads/2016/07/10947215_1015598238455044_8111933369934393156_n.jpg,,,,,,,,,,,,,,,,,,,,,,,,,,,,,,,,,,,,,,,,
1101,Green Papaya Classic Thai Cuisine,261,"Green Papaya is well-known with 2 locations in Ottawa and 1 in Gatineau, along with a food truck that appears at many events across the city.

See the Vegetable section of the menu for many vegan curries as well as tofu and eggplant dishes.",Restaurants,Restaurants,"Best Asian Restaurants with Vegan and Vegetarian Options in Ottawa,Cuisine,Curry,Papaya,Restaurant,thai",gd_place,publish,,,1,0,Never,2016-07-03 11:45,256 Preston,Ottawa,Ontario,Canada,,45.4044034,-75.7119835,Little Italy,45.4044034,-75.7119835,Lunch Mon - Fri: 11:30am - 2:30pm  Dinner Mon - Thu: 5:00pm - 10:00pm Fri - Sat: 5:00pm - 11:00pm Sun: 5:00pm - 10:00pm,6132318424,,http://www.greenpapaya.ca,https://twitter.com/GreenPapayaRest,https://www.facebook.com/Green-Papaya-Classic-Thai-Cuisine-264869630195254/,,,,,"Vegan,Vegetarian",Get Directions,GreenPapayaRest,,,1,"claimed,geodir_email,geodir_ethicalcriteria,geodir_backendextrainfo,geodir_menu,post_tags,geodir_twitter,geodir_website",0,https://ethicaltree.com/wp-content/uploads/2017/03/1101_482017_408946562475221_107324980_n.jpg,https://ethicaltree.com/wp-content/uploads/2016/07/185588_264870516861832_1660063_n.jpg,,,,,,,,,,,,,,,,,,,,,,,,,,,,,,,,,,,,,,,,
1103,Green Papaya Merivale,261,"Green Papaya is well-known with 2 locations in Ottawa and 1 in Gatineau, along with a food truck that appears at many events across the city.

See the Vegetable section of the menu for many vegan curries as well as tofu and eggplant dishes.",Restaurants,Restaurants,"Best Asian Restaurants with Vegan and Vegetarian Options in Ottawa,Cuisine,Curry,Papaya,Restaurant,thai",gd_place,publish,,,1,0,Never,2016-07-03 11:47,1374 Baseline Rd,Ottawa,Ontario,Canada,,45.3622429,-75.7370181,,,,Lunch Mon - Fri: 11:30am - 2:30pm  Dinner Mon - Thu: 5:00pm - 10:00pm Fri - Sat: 5:00pm - 11:00pm Sun: 5:00pm - 10:00pm,6132388424,,http://www.greenpapaya.ca,https://twitter.com/GreenPapayaRest,https://www.facebook.com/Green-Papaya-Merivale-427980394051770/,,,,,"Vegan,Vegetarian",Get Directions,GreenPapayaRest,,,0,,1101,https://ethicaltree.com/wp-content/uploads/2017/03/1103_482017_408946562475221_107324980_n.jpg,https://ethicaltree.com/wp-content/uploads/2016/07/1103_185588_264870516861832_1660063_n.jpg,,,,,,,,,,,,,,,,,,,,,,,,,,,,,,,,,,,,,,,,
