post_id,post_title,post_author,post_content,post_category,default_category,post_tags,post_type,post_status,is_featured,claimed,package_id,alive_days,expire_date,post_date,post_address,post_city,post_region,post_country,post_zip,post_latitude,post_longitude,post_neighbourhood,neighbourhood_latitude,neighbourhood_longitude,geodir_timing,geodir_contact,geodir_email,geodir_website,geodir_twitter,geodir_facebook,geodir_video,geodir_special_offers,linked_cpt_ID,geodir_backendextrainfo,geodir_ethicalcriteria,geodir_get_directions,geodir_twitterusername,geodir_Instagram,geodir_Calltoaction,gd_is_franchise,gd_franchise_lock,franchise,IMAGE,IMAGE,IMAGE,IMAGE,IMAGE,IMAGE,IMAGE,IMAGE,IMAGE,IMAGE,IMAGE,IMAGE,IMAGE,IMAGE,IMAGE,IMAGE,IMAGE,IMAGE,IMAGE,IMAGE,IMAGE,IMAGE,IMAGE,IMAGE,IMAGE,IMAGE,IMAGE,IMAGE,IMAGE,IMAGE,IMAGE,IMAGE,IMAGE,IMAGE,IMAGE,IMAGE,IMAGE,IMAGE,IMAGE,IMAGE,IMAGE,IMAGE
206,Carleton University - Vegan food bar,1,"This is the Carleton student's residential cafeteria but is open to all. Cash only.

Many food stalls available; one of which is exclusively vegan and well-labelled.",Restaurants,Restaurants,"American,Canadian,Restaurant,Vegan",gd_place,publish,,,1,0,Never,2016-04-14 13:23,1125 Colonel By Dr,Ottawa,Ontario,Canada,"K1S, Ca",45.383532,-75.697517,Old Ottawa South,45.393166,-75.6824865,Open during school semester and hours,6135202600,diningservices@carleton.ca,http://dining.carleton.ca,http://twitter.com/CarletonDining,https://www.facebook.com/cudining,,,,,"Vegan,Vegetarian",Get Directions,CarletonDining,,,0,,0,https://ethicaltree.com/wp-content/uploads/2017/03/206_Screen-Shot-2017-03-19-at-7.32.17-PM.png,https://ethicaltree.com/wp-content/uploads/2016/04/Carleton.png,,,,,,,,,,,,,,,,,,,,,,,,,,,,,,,,,,,,,,,,
260,Cafe My House,261,"Plant-based restaurant in Hintonburg. Seasonal &amp; changing menu.

Organic fair-trade coffee and tea.

Weekend brunches 10am-2pm.
Sunday Pizza Special.

NCVA members get 10% discount",Restaurants,Restaurants,"Best Entirely Vegetarian and Vegan Restaurants in Ottawa,Best Sit-Down Restaurants in Ottawa,Best Vegan and Vegetarian Breakfast and Brunch Spots in Ottawa,Best Woman-owned Restaurants in Ottawa,Restaurant",gd_place,publish,,,1,0,Never,2017-02-06 1:08,1015 Wellington St. W,Ottawa,Ontario,Canada,K1Y 2Y1,45.4050029,-75.7237729,Hintonburg,45.4017503,-75.7267089,"Tues-Thurs 5:30-9:30pm; Fri 5:30-10:30pm; Sat 10am-2pm, 5:30-10:30pm; Sun 10am-2pm, 5:30-9:30pm; closed Mondays",6137330707,info@cafemyhouse.com,http://www.cafemyhouse.com,https://twitter.com/CafeMyHouse,https://www.facebook.com/CafeMyHouse/,,,,Owner/Chef Briana Kim,"Vegan,Vegetarian,Fair trade,Woman-owned,Organic",Get Directions,CafeMyHouse,,,0,,0,https://ethicaltree.com/wp-content/uploads/2016/08/260_13631573_1403670079646841_8777734907432306637_n.jpg,https://ethicaltree.com/wp-content/uploads/2016/05/1601378_813012005379321_575540130_n.jpg,,,,,,,,,,,,,,,,,,,,,,,,,,,,,,,,,,,,,,,,
264,Ola Cocina,55,"Ola Cocina is a fun little spot in Ottawa that offers catering services and great meals to bring home.

Vegan options: For breakfast or brunch they have a veg-mix they can replace egg with in any dish - try the vegan juevos rancheros! For lunch they have vegan-friendly options for most items including tortas and tacos.",Restaurants,Restaurants,"Best Mexican Restaurants with Vegan and Vegetarian Options in Ottawa,Best Vegan and Vegetarian Breakfast and Brunch Spots in Ottawa,February2017,gluten-free,Mexican,Restaurant",gd_place,publish,,1,1,0,Never,2016-05-17 12:28,62 Barrette St,Ottawa,Ontario,Canada,K1L 8A5,45.4395154,-75.6749014,Ottawa East,45.4145372,-75.647384,Mon Closed;  Tues-Fri 11:30am-8pm;  Sat 10am-8pm;  Sun 10am-3pm,6137466222,olacocina@gmail.com,http://Www.olacocina.ca,http://twitter.com/olacocina,https://www.facebook.com/Olacocina/,,,,,"Vegan,Vegetarian,Woman-owned",Get Directions,olacocina,,,0,,0,https://ethicaltree.com/wp-content/uploads/2016/05/10466980_597366807052543_7313514945877737820_o.jpg,https://ethicaltree.com/wp-content/uploads/2016/05/13082665_865199276935960_201117007214825604_n.jpg,,,,,,,,,,,,,,,,,,,,,,,,,,,,,,,,,,,,,,,,
266,SimplyRaw Express,261,"Raw juice bar & healthy lifestyle center. One hundred percent plant-based and gluten-free. Educational workshops, culinary classes, detox and nutritional programs.

Fair Trade coffee and tea available.

NCVA members get 10% discount on food and drinks",Restaurants,Restaurants,"Best Entirely Vegetarian and Vegan Restaurants in Ottawa,Best Vegan and Vegetarian Restaurants for Grab-and-Go Lunches in Ottawa,Best Woman-owned Restaurants in Ottawa,gluten-free,juice,Raw,Restaurant,Take-out,Vegan",gd_place,publish,,,1,0,Never,2016-05-17 12:53,989 Wellington Street West,Ottawa,Ontario,Canada,K1Y 2Y1,45.4055588,-75.7230957,Hintonburg,45.4017503,-75.7267089,"Tues-Fri:	 08:00 - 19:00 Sat-Sun:	 10:00 - 18:00",6132340806,info@simplyraw.ca,http://www.simplyrawexpress.com,https://twitter.com/SimplyRawXpress,https://www.facebook.com/simplyrawexpress/,,,,Owner Natasha Kyssa,"Vegan,Vegetarian,Fair trade,Woman-owned",Get Directions,SimplyRawXpress,,,0,,0,https://ethicaltree.com/wp-content/uploads/2017/03/266_16143330_1313005458773925_4178486890016897233_n.jpg,https://ethicaltree.com/wp-content/uploads/2016/05/10465429_661365820604562_4999400665718638589_o.jpg,,,,,,,,,,,,,,,,,,,,,,,,,,,,,,,,,,,,,,,,
268,Bread & Sons Bakery,261,"Everything homemade.

Vegetarian bakery and coffee shop. Makes breads and baked goods, date squares, soups, salads, hummus, sandwiches, pizza.

The ""All the Worlds Green"" is a vegan pizza with spinach, kale, arugula, olives, garlic, red peppers and roasted sweet potato (no cheese substitute).",Cafés and Bakeries,Cafés and Bakeries,"Bakery,Best Entirely Vegetarian and Vegan Restaurants in Ottawa,Best Vegan and Vegetarian Restaurants with Delivery in Ottawa,Cafe,coffee,Pizza,sandwhiches",gd_place,publish,,,1,0,Never,2016-05-17 13:05,195 Bank Street,Ottawa,Ontario,Canada,K2P 1W7,45.417717,-75.6981892,centretown-1-1-1,45.4133828,-75.6943837,"Mon-Thu 6:30am-6:30pm, Fri 6:30am-8:00pm, Sat 8:30am-7:30pm",6132305302,breadandsons@gmail.com,http://breadandsons.com,,https://www.facebook.com/Bread-Sons-Bakery-111306055621792/,,,,,"Vegan,Vegetarian",Get Directions,,,,0,,0,https://ethicaltree.com/wp-content/uploads/2017/08/268_18423180_1174441749332930_6601720426704920367_o.jpg,https://ethicaltree.com/wp-content/uploads/2017/08/268_294380_152011698217894_1829471_n.jpg,,,,,,,,,,,,,,,,,,,,,,,,,,,,,,,,,,,,,,,,
270,Govinda's Vegetarian Buffet,261,"GOVINDA'S is Ottawa's first and oldest vegetarian establishment, since 1981. GOVINDA'S is operated on a non-profit basis by the International Society for Krishna Consciousness (ISKCON). We provide an “All You Can Eat” hot and cold buffet. GOVINDA'S offers food for the body, mind and spirit.

Entirely vegan buffet. Only $5 for students and $7 for others, all-you-can eat simple Indian food. Rice with lentils, curry and salad.",Restaurants,Restaurants,"Best Entirely Vegetarian and Vegan Restaurants in Ottawa,Best Indian Restaurants with Vegetarian and Vegan options (Ottawa),Buffet,cheap,Indian,Restaurant,Vegan",gd_place,publish,,,1,0,Never,2017-03-28 8:14,212 Somerset Street East,Ottawa,Ontario,Canada,K1N 6V4,45.4226367,-75.6788278,Sandy Hill,45.4257867,-75.68156,Mon.- Fri.  5:00 – 8:00 pm,6135656544,info@ethicaltree.com,http://ottawa.iskcon.ca/homepage/buffet2.htm,,https://www.facebook.com/govindasottawa/,,,,,"Vegan,Vegetarian",Get Directions,,,,0,,0,https://ethicaltree.com/wp-content/uploads/2016/08/270_14261.jpg,https://ethicaltree.com/wp-content/uploads/2016/05/247286_206347289404749_2530458_n.jpg,,,,,,,,,,,,,,,,,,,,,,,,,,,,,,,,,,,,,,,,
272,Peace-Garden,261,"Peace Garden is an international, gourmet, vegetarian/vegan organic fair-trade coffee shop that offers culinary delectables, specializes in 100% fresh power smoothies and juices, world-class catering, homemade vegan truffles and offers many gluten-free items including a fabulous vegan chocolate mousse.
Call ahead (613-562-2434) and be ready to receive your take-out order in bio containers or eat-in and enjoy the ambiance.",Restaurants,Restaurants,"Best Entirely Vegetarian and Vegan Restaurants in Ottawa,Best Organic Restaurants and Businesses (Ottawa),Fair Trade,Organic,Restaurant,Smoothies,Vegan",gd_place,publish,,,1,0,Never,2016-05-17 13:18,47 Clarence St,Ottawa,Ontario,Canada,K1N 9K1,45.4288716,-75.6939885,Byward Market,45.4272431,-75.694269,"Mon - Fri:	10:00 - 19:00 Sat - Sun:	09:00 - 18:00",6135622434,,http://www.peacegarden.com,,https://www.facebook.com/pages/Peace-Garden/357858314414952,,,,,"Vegan,Vegetarian,Fair trade,Organic",Get Directions,,,,0,,0,https://ethicaltree.com/wp-content/uploads/2017/03/272_Screen-Shot-2017-03-19-at-7.27.42-PM.png,https://ethicaltree.com/wp-content/uploads/2016/05/peacegarden.jpg,,,,,,,,,,,,,,,,,,,,,,,,,,,,,,,,,,,,,,,,
273,Perfection-Satisfaction-Promise,193,"Perfection-Satisfaction-Promise is dedicated to conscious living and healthy eating. We are independently owned and operated, inspired by the study of meditation and the spiritual teachings of Sri Chinmoy whose vision of world peace and oneness is the guiding force behind our food preparation and customer service. Our menu's flavours are culturally inspired and includes a growing supply of seasonally available, locally farmed organic ingredients – all prepared with loving care in-house from scratch.

Vegan and gluten-free options are always plentiful! We are 100% vegetarian.

See our website for clearly-labelled vegan and gluten-free options.

Locally roasted Fair Trade Coffee and Tea from Equator Coffee, specialty beverages and home-made artisan desserts.",Restaurants,Restaurants,"Best Entirely Vegetarian and Vegan Restaurants in Ottawa,Best Indian Restaurants with Vegetarian and Vegan options (Ottawa),Best Organic Restaurants and Businesses (Ottawa),Best Vegan and Vegetarian Breakfast and Brunch Spots in Ottawa,Best Vegan and Vegetarian Burgers in Ottawa,Best Woman-owned Restaurants in Ottawa,gluten-free,Indian,March2017,Restaurant,Vegan",gd_place,publish,,1,1,0,Never,2016-05-17 13:23,167 Laurier Ave E,Ottawa,Ontario,Canada,K1N6N8,45.42524,-75.683589,Sandy Hill,45.4257867,-75.68156,Monday 10 am - 8 pm Tuesday 10 am - 8 pm Wednesday 10 am - 5 pm*  Every Wednesday we close at 5 pm Thursday 10 am - 8 pm Friday 10 am - 8 pm Saturday 12 noon - 9 pm Sunday  closed,6132347299,info@perfection-satisfaction-promise.ca,http://perfection-satisfaction-promise.ca/en/,,https://www.facebook.com/Perfection-Satisfaction-Promise-124267980949035/,,,,Owner: Prapti,"Vegan,Vegetarian,Fair trade,Woman-owned,Organic",Get Directions,,,,0,,0,https://ethicaltree.com/wp-content/uploads/2017/02/273_burger-joy-blackbean-beet.jpg,https://ethicaltree.com/wp-content/uploads/2017/02/273_PSP_logo_2016.jpg,,,,,,,,,,,,,,,,,,,,,,,,,,,,,,,,,,,,,,,,
275,Pure Kitchen (Richmond Rd),54,"Pure Kitchen.
We are fresh, vegetarian and always delicious. Juice bar, table service, take out, juice cleanses and so much more! Purely awesome

Fair Trade Coffee from Equator Coffee Roasters, roasted locally in Almonte, ON.",Restaurants,Restaurants,"Best Entirely Vegetarian and Vegan Restaurants in Ottawa,Best Sit-Down Restaurants in Ottawa,Best Vegan and Vegetarian Breakfast and Brunch Spots in Ottawa,Best Vegan and Vegetarian Burgers in Ottawa,juice,Poutine,Raw,Restaurant,Strawberry Blonde Retailers,Take-out,Vegan",gd_place,publish,,1,1,0,Never,2016-05-17 13:35,357 Richmond rd,Ottawa,Ontario,Canada,K2A 0E7,45.391751,-75.7547261,Westboro,45.3922459,-75.7532734,"Mon-Wed:	 11:00 - 21:00 Thurs-Sat:	 11:00 - 22:00 Sun:	 11:00 - 21:00",6136805500,,http://www.purekitchenottawa.com,https://twitter.com/purekitchenott,https://www.facebook.com/Pure-Kitchen-Ottawa-1542921929278480/,,,,,"Vegan,Vegetarian,Fair trade,Woman-owned",Get Directions,purekitchenott,,,1,"gd_placecategory,geodir_email,geodir_ethicalcriteria,geodir_backendextrainfo,geodir_facebook,post_desc,geodir_menu,geodir_twitter,geodir_website",0,https://ethicaltree.com/wp-content/uploads/2016/08/275_Screen-Shot-2016-08-10-at-1.07.29-AM.png,https://ethicaltree.com/wp-content/uploads/2016/05/11016100_1615406718696667_1709140650989569644_n.png,,,,,,,,,,,,,,,,,,,,,,,,,,,,,,,,,,,,,,,,
277,Green Door Vegetarian Restaurant,261,"The Green Door is Ottawa’s oldest and best-known vegetarian restaurant, established in 1988. We use only quality ingredients. Our preferred source for produce is local and organic. Most menu choices are vegan, many gluten-free. There is also a ""Green Door Grocer"" next door with Fair Trade, Organic and Vegan retail goods.

Buffet, pay-by-weight restaurant. Entirely vegetarian and items are labelled if they contain eggs or dairy.

Fair Trade coffee and hot chocolate. Organic tea.",Restaurants,Restaurants,"Best Entirely Vegetarian and Vegan Restaurants in Ottawa,Best Organic Restaurants and Businesses (Ottawa),Best Vegan and Vegetarian Breakfast and Brunch Spots in Ottawa,Buffet,f02,gluten-free,Healthy Vegan and Vegetarian Restaurants in Ottawa,Organic,Restaurant,Vegan",gd_place,publish,,,1,0,Never,2016-05-17 13:43,198 Main St,Ottawa,Ontario,Canada,K1S1C6,45.407995,-75.6773717,Old Ottawa South,45.393166,-75.6824865,"Tues-Sun:	 11:00 - 21:00",6132349597,info@thegreendoor.ca,http://www.thegreendoor.ca,https://twitter.com/greendoorfood,https://www.facebook.com/TheGreenDoorVegetarianRestaurant/,,,,,"Vegan,Vegetarian,Fair trade,Organic",Get Directions,greendoorfood,,,0,,0,https://ethicaltree.com/wp-content/uploads/2016/08/277_Ottawa-059.jpg,,,,,,,,,,,,,,,,,,,,,,,,,,,,,,,,,,,,,,,,,
280,The Tea Party Cafe,66,"We are a cozy cafe that specializes in a large assortment of looses leaf tea. We bake our own goodies and offer a vegetarian lunch menu.

Fair Trade, locally-roasted coffee.",Cafés and Bakeries,Cafés and Bakeries,"Best Fair Trade Coffee Shops (Ottawa),Best Places to Work and Study in Ottawa,Best Vegan and Vegetarian Breakfast and Brunch Spots in Ottawa,Cafe,Fairtrade,Tea",gd_place,publish,,1,1,0,Never,2016-05-17 13:58,119 York St.,Ottawa,Ontario,Canada,K1N 5T4,45.429426,-75.690583,byward-market-1,45.4288038,-75.694015,"Mon-Thurs:	 10:00 - 18:00 Fri:	 10:00 - 00:00 Sat-Sun:	 10:00 - 18:00",6135620352,christine@theteapartycafe.com,http://www.theteapartycafe.com,https://twitter.com/theteapartycafe,https://www.facebook.com/theteapartycafeottawa/,,,,,"Vegan,Vegetarian,Fair trade",Get Directions,theteapartycafe,,,0,,0,https://ethicaltree.com/wp-content/uploads/2016/08/280_Screen-Shot-2016-08-10-at-1.56.17-AM.png,https://ethicaltree.com/wp-content/uploads/2016/05/10440238_10153325586419045_4909094402324676781_n.jpg,,,,,,,,,,,,,,,,,,,,,,,,,,,,,,,,,,,,,,,,
286,Asian Stars Restaurant,261,"Our menu offers a diversity of authentic, homemade dishes from all the corners of Asia under one roof. We cater to a variety of dietary needs (such as vegan, vegetarian and gluten-free) and every dish is prepared daily by an experienced chef using fresh ingredients.

NCVA members get 10% discount",Restaurants,Restaurants,"Asian,Best Asian Restaurants with Vegan and Vegetarian Options in Ottawa,f02,gluten-free,Pho,Restaurant,Vegan",gd_place,publish,,,1,0,Never,2016-05-17 14:13,1380 Clyde Ave Unit B,Ottawa,Ontario,Canada,K2G 3H9,45.3596441,-75.7393439,,,,"Mon-Wed:	 11:00 - 21:00 Thurs-Sat:	 11:00 - 22:00 Sun:	 12:00 - 21:00",6136952288,asianstarsocial@asianstarsrestaurant.com,http://asianstarsrestaurant.com/menu.html,http://twitter.com/AsianStarsResto,https://www.facebook.com/asianstarsrestaurant/,,,,,"Vegan,Vegetarian,Woman-owned",Get Directions,AsianStarsResto,,,0,,0,https://ethicaltree.com/wp-content/uploads/2017/03/286_14444819_1105859556158304_8288473652081407981_o.jpg,https://ethicaltree.com/wp-content/uploads/2016/05/10383748_670144756396455_2683712391166662285_o.jpg,,,,,,,,,,,,,,,,,,,,,,,,,,,,,,,,,,,,,,,,
288,Cafe Nostalgica,79,"Café Nostalgica is a diverse &amp; dynamic restaurant and cultural space. Le Café Nostalgica est un restaurant et espace culturelle diversifiée &amp; dynamique.

Serves meat, veg options available. Cafe owned and operated by the Grad Students' Association at the university. The brunch menu includes vegan pancakes and a vegan breakfast sandwich. The regular menu has around 6 vegan items plus a daily vegan special and vegan soup of the day. Uses tofu, tempeh, veggie burger, vegan cheese.

Fair Trade coffees and teas.

<a href=""http://nostalgica.ca/catering/referral-program/"">Catering Referral Program: Click here</a> to share 10% off catering services with a friend, and you'll get 10% off catering for your next event, too!

Delivery now available at <a href=""http://www.skipthedishes.com/cafe-nostalgica"">SkipTheDishes.com/Cafe-Nostalgica</a>

&nbsp;

&nbsp;",Restaurants,Restaurants,"beer,Best Fair Trade Coffee Shops (Ottawa),Best Places to Work and Study in Ottawa,Best Vegan and Vegetarian Breakfast and Brunch Spots in Ottawa,Best Vegan and Vegetarian Burgers in Ottawa,Catering,coffee,March2017,Poutine,Restaurant,students,XF",gd_place,publish,1,1,2,0,Never,2018-02-16 14:18,601 rue Cumberland St.,Ottawa,Ontario,Canada,K1N 6N5,45.4238241,-75.6840957,sandy-hill-1,45.4231505,-75.6866439,"Mon-Fri:	 09:00 - 02:00",6135625800,nostalgica@gsaed.ca,http://www.nostalgica.ca,https://twitter.com/cafenostalgica,https://www.facebook.com/cafenostalgica/,,,,,"Vegan,Vegetarian,Fair trade,Organic",Get Directions,cafenostalgica,,,0,,0,https://ethicaltree.com/wp-content/uploads/2018/03/288_nvegannachos.jpg,https://ethicaltree.com/wp-content/uploads/2018/04/288_Image-uploaded-from-iOS.jpg,https://ethicaltree.com/wp-content/uploads/2018/04/288_Image-uploaded-from-iOS-1.jpg,https://ethicaltree.com/wp-content/uploads/2018/03/288_N55.jpg,https://ethicaltree.com/wp-content/uploads/2018/03/288_N3.jpg,https://ethicaltree.com/wp-content/uploads/2018/03/288_N1.jpg,https://ethicaltree.com/wp-content/uploads/2017/03/288_17349992_1407666695921668_6394384026468552393_o.jpg,,,,,,,,,,,,,,,,,,,,,,,,,,,,,,,,,,,
290,Fiazza Fresh Fired (Byward Market),261,"Looking for more Fresh in your Food? Come to Fiazza for a Fresh take on real pizza.

Fiazza makes custom-made pizzas and has Daiya vegan cheese available. Pesto is also vegan here. They serve craft beers and have an outdoor patio.",Restaurants,Restaurants,"beer,Best Sit-Down Restaurants in Ottawa,Best Vegan and Vegetarian Restaurants with Delivery in Ottawa,Pizza,Restaurant,Strawberry Blonde Retailers,Vegan",gd_place,publish,,,1,0,Never,2016-05-17 14:46,86 Murray Street,Ottawa,Ontario,Canada,K1N 5M6,45.4297285,-75.6935772,byward-market-1-1-1,45.4294137,-75.6914195,"Mon-Wed:	 11:00 - 21:00 Thurs-Sat:	 11:00 - 22:00 Sun:	 12:00 - 21:00",6135622000,communications@fiazza.ca,http://www.fiazza.ca,https://twitter.com/fiazzafreshfire,https://www.facebook.com/fiazzafreshfired/,,,,,"Vegan,Vegetarian",Get Directions,fiazzafreshfire,,,1,"claimed,geodir_timing,gd_placecategory,geodir_email,geodir_ethicalcriteria,geodir_backendextrainfo,geodir_facebook,geodir_get_directions,post_desc,geodir_menu,post_tags,geodir_twitter,geodir_website",0,https://ethicaltree.com/wp-content/uploads/2017/03/290_16819437_573373206197942_1573999720880733771_o.jpg,https://ethicaltree.com/wp-content/uploads/2016/05/12522984_431103773758220_2929322145058601392_n.jpg,,,,,,,,,,,,,,,,,,,,,,,,,,,,,,,,,,,,,,,,
294,Hareg Cafe,261,"Hareg is a new Café at the heart of the vibrant Glebe community in Ottawa. We serve exotic Ethiopian and Eritrean breakfast, lunch, and dinner. We also serve hot beverages Cappuccino, Espresso... Upon request, we brew Ethiopian Coffee. Breakfast is now available weekend mornings, come pay us a visit for an affordable and authentic meal.

There are many veg options available both on the menu and in the buffet. During the week, it offers an all-you-can-eat vegan lunch buffet with 10+ hot and cold items. On the weekend it offers some meat dishes to the buffet. Traditional coffee ceremony on weekends or by request.

NCVA members get 10% discount",Restaurants,Restaurants,"African,coffee,Ethiopian,Hareg Cafe,Restaurant,Vegan,Vegetarian,XF",gd_place,publish,1,,4,0,Never,2018-02-13 23:23,587 Bank Street,Ottawa,Ontario,Canada,K1S 3T4,45.407898,-75.6909779,The Glebe,45.3993494,-75.6853936,,6136952488,haregvariety@gmail.com,http://www.haregcafeottawa.com/,https://twitter.com/HaregCafe,https://www.facebook.com/Hareg-Cafe-576021932430846/,,,,,"Vegan,Vegetarian",Get Directions,HaregCafe,,,0,,0,https://ethicaltree.com/wp-content/uploads/2017/12/294_12512219_1133696349996732_6854739739746466020_n.jpg,https://ethicaltree.com/wp-content/uploads/2017/12/294_13092178_1161043077262059_3519971705629018792_n.jpg,https://ethicaltree.com/wp-content/uploads/2017/12/294_Screen-Shot-2017-12-21-at-1.57.30-PM.png,https://ethicaltree.com/wp-content/uploads/2017/12/294_10888900_889225224443847_973245799964951761_n.jpg,https://ethicaltree.com/wp-content/uploads/2017/12/294_12615241_1102735943092773_3304967924524279005_o.jpg,https://ethicaltree.com/wp-content/uploads/2017/12/294_12654330_1106626359370398_6117233577378291025_n.jpg,https://ethicaltree.com/wp-content/uploads/2017/12/294_12733386_1110966932269674_947826164143455518_n.jpg,https://ethicaltree.com/wp-content/uploads/2018/01/294_12741871_1111737045525996_9183544201365118297_n.jpg,https://ethicaltree.com/wp-content/uploads/2017/12/294_10264758_1117647654934935_5694012547211288846_n.jpg,,,,,,,,,,,,,,,,,,,,,,,,,,,,,,,,,
296,Host India,261,"HostIndia combines the excellence of elegance and taste with affordability. You’ll find that every bite provides and incredible taste sensation. We use only the best ingredients and fragrant spice to bring you authentic Indian flavours.

The buffet choices typically includes vegetarian options like tarkha daal, lentils, punjab rice, and naan. Dairy is used in some items, but plenty of vegan options.

NCVA members get 10% discount",Restaurants,Restaurants,"Best Indian Restaurants with Vegetarian and Vegan options (Ottawa),Buffet,Indian,Pakistani,Restaurant",gd_place,publish,,,1,0,Never,2016-05-17 15:06,622 Montreal Road,Ottawa,Ontario,Canada,K1K 0T6,45.4424217,-75.6417417,Ottawa East,45.4145372,-75.647384,"Mon-Thurs:	 11:30 - 14:00 17:00 - 21:30 Fri-Sat:	 11:30 - 14:00 17:00 - 22:00 Sun:	 11:30 - 14:00 17:00 - 21:00",6137464678,contact@hostindia.com,http://hostindia.ca,https://twitter.com/HostIndiaOttawa,https://www.facebook.com/HostIndiaOttawa/,,,,,"Vegan,Vegetarian",Get Directions,HostIndiaOttawa,,,0,,0,https://ethicaltree.com/wp-content/uploads/2017/03/296_1382212_652602134771984_622704914_n.jpg,https://ethicaltree.com/wp-content/uploads/2016/05/935331_567407416624790_1823902885_n.png,,,,,,,,,,,,,,,,,,,,,,,,,,,,,,,,,,,,,,,,
298,Panago Pizza,57,"At Panago we are proud to offer something for everyone, including Vegetarians + Vegans! Try our Vegan Deluxe Pepperoni Pizza or create your own. With an exceptional variety of fresh, quality toppings, our selection is unmatched. Vegans can choose between 5 crusts, 6 sauces, 17 toppings and 1 cheese (Daiya). We also have fresh salads and a Vegan dressing. Come visit our Ottawa location at Bank and Sunnyside!",Restaurants,Restaurants,"Best Vegan and Vegetarian Restaurants with Delivery in Ottawa,daiya,f02,Pizza,Restaurant,Vegan",gd_place,publish,,1,1,0,Never,2016-05-17 15:23,1069 Bank St.,Ottawa,Ontario,Canada,K1S 3W9,45.3946661,-75.6834201,Old Ottawa South,45.393166,-75.6824865,Sun - Thurs 11am - 11pm Fri + Sat 11am - 12am,6133100001,info@panago.com,http://www.panago.com/,https://twitter.com/Panago_Pizza,https://www.facebook.com/panago/,,,,,"Vegan,Vegetarian,Woman-owned",Get Directions,Panago_Pizza,,,0,,0,https://ethicaltree.com/wp-content/uploads/2016/07/298_CPP4843_Photos-for-Online-Franchise-Listings_Horiz_VegMed.jpg,https://ethicaltree.com/wp-content/uploads/2016/05/295128_10150869374393496_1052493526_n.jpg,,,,,,,,,,,,,,,,,,,,,,,,,,,,,,,,,,,,,,,,
300,Play Food and Wine,261,"Stephen Beckta and Mike Moffatt's small plate restaurant and wine bar in the Byward Market.

Play has a separate vegan menu you can ask for - There will always be excellent vegan options but there may be limited selection. Staff are also knowledgeable about which of their wines are sourced from vegan wineries.",Restaurants,Restaurants,"Best Sit-Down Restaurants in Ottawa,February2017,fine dining,food,Play,Restaurant,Wine",gd_place,publish,,,1,0,Never,2016-05-17 15:43,1 York St.,Ottawa,Ontario,Canada,K1N 5S7,45.4276953,-75.6948757,byward-market-1-1-1,45.4294137,-75.6914195,"Mon:	 12:00 - 14:00 17:30 - 22:00 Tues-Wed:	 12:00 - 14:00 17:30 - 23:00 Thurs:	 12:00 - 02:00 17:30 - 23:00 Fri:	 12:00 - 14:00 17:30 - 12:00 Sat:	 12:00 - 00:00 Sun:	 12:00 - 22:00",6136679207,info@playfood.ca,http://www.playfood.ca,http://twitter.com/playfoodandwine,https://www.facebook.com/Play-Food-and-Wine-113507357312/,,,,,"Vegan,Vegetarian",Get Directions,playfoodandwine,,,0,,0,https://ethicaltree.com/wp-content/uploads/2016/05/171865_10150101408992313_6978990_o.jpg,https://ethicaltree.com/wp-content/uploads/2016/05/1936687_113507797312_1696251_n.jpg,,,,,,,,,,,,,,,,,,,,,,,,,,,,,,,,,,,,,,,,
